{
  "version": "people-landscape-chin-safe-proof-overrides-v1",
  "status": "proof-candidate",
  "publicationAuthorised": false,
  "ordering": "tmdb-person-id-ascending",
  "recordCount": 13,
  "records": [
    {
      "stableKey": "person:32",
      "tmdbPersonId": 32,
      "canonicalName": "Robin Wright",
      "format": "landscape",
      "status": "proof-candidate",
      "sourceProfilePath": "/d3rIv0y2p0jMsQ7ViR7O1606NZa.jpg",
      "sourceHash": "ff319c0427307298fc9e454a2c9bd0cecae4c3a760dbae3fc324b8d9956bf17b",
      "basePresetId": "people-landscape-cormorant-v1",
      "basePresetHash": "a94f863b9332332617355fd73265571dc9b3ccf055365674757d76ac2c48faad",
      "cropStrategy": "person-specific-source-bound-landscape-v1",
      "cropRectangle": { "left": 0, "top": 0, "width": 600, "height": 750 },
      "cropScale": { "x": 0.9, "y": 0.9 },
      "cropOffsetX": 558,
      "cropOffsetY": 0,
      "reason": "chin-jaw-neck-breathing-room",
      "evidencePackage": "tools/people-seed/.work/people-v3-artwork-proof/attempt-20260802T062411Z/landscape-correction/prototypes",
      "proofOutputHash": "1ec9c486b49cf24b7ca4e930f42ee34d179990693d8e4ce912177335e946378f",
      "createdFromAuditVersion": "people-v3-landscape-chin-safe-audit-v1",
      "prototypeTier": "tier-2-moderate"
    },
    {
      "stableKey": "person:47",
      "tmdbPersonId": 47,
      "canonicalName": "Björk",
      "format": "landscape",
      "status": "proof-candidate",
      "sourceProfilePath": "/Ahc3TWomYakLcbqZRVBDdf3rhMR.jpg",
      "sourceHash": "704e758c74501351e343c900268de9867509e54d32f6aed23310aab9b5166555",
      "basePresetId": "people-landscape-cormorant-v1",
      "basePresetHash": "a94f863b9332332617355fd73265571dc9b3ccf055365674757d76ac2c48faad",
      "cropStrategy": "person-specific-source-bound-landscape-v1",
      "cropRectangle": { "left": 0, "top": 0, "width": 1493, "height": 1866 },
      "cropScale": { "x": 0.361688, "y": 0.361736 },
      "cropOffsetX": 558,
      "cropOffsetY": 0,
      "reason": "chin-jaw-neck-breathing-room",
      "evidencePackage": "tools/people-seed/.work/people-v3-artwork-proof/attempt-20260802T062411Z/landscape-correction/prototypes",
      "proofOutputHash": "1324d514ad3eb2c25893c7317f95182cb16b363935557024f88d42878c9468b7",
      "createdFromAuditVersion": "people-v3-landscape-chin-safe-audit-v1",
      "prototypeTier": "tier-2-moderate"
    },
    {
      "stableKey": "person:63",
      "tmdbPersonId": 63,
      "canonicalName": "Milla Jovovich",
      "format": "landscape",
      "status": "proof-candidate",
      "sourceProfilePath": "/usWnHCzbADijULREZYSJ0qfM00y.jpg",
      "sourceHash": "1dd9b9085ea926c1d383d6939b01ff905d76a242d1cf222f8bac6faef8390103",
      "basePresetId": "people-landscape-cormorant-v1",
      "basePresetHash": "a94f863b9332332617355fd73265571dc9b3ccf055365674757d76ac2c48faad",
      "cropStrategy": "person-specific-source-bound-landscape-v1",
      "cropRectangle": { "left": 0, "top": 0, "width": 720, "height": 818 },
      "cropScale": { "x": 0.825, "y": 0.825183 },
      "cropOffsetX": 504,
      "cropOffsetY": 0,
      "reason": "chin-jaw-neck-breathing-room",
      "evidencePackage": "tools/people-seed/.work/people-v3-artwork-proof/attempt-20260802T062411Z/landscape-correction/prototypes",
      "proofOutputHash": "1ef74bdc795a24934c325a40c96fb934c9313574b1474e3e473854accbce2acf",
      "createdFromAuditVersion": "people-v3-landscape-chin-safe-audit-v1",
      "prototypeTier": "tier-1-slight"
    },
    {
      "stableKey": "person:65",
      "tmdbPersonId": 65,
      "canonicalName": "Ian Holm",
      "format": "landscape",
      "status": "proof-candidate",
      "sourceProfilePath": "/cOJDgvgj4nMec6Inzj1H5nugTO5.jpg",
      "sourceHash": "f7d5d1fcd35b05f5d9dabcb4fea25fc9a8ddcee97863febd2f8cfd190c1edaab",
      "basePresetId": "people-landscape-cormorant-v1",
      "basePresetHash": "a94f863b9332332617355fd73265571dc9b3ccf055365674757d76ac2c48faad",
      "cropStrategy": "person-specific-source-bound-landscape-v1",
      "cropRectangle": { "left": 0, "top": 0, "width": 700, "height": 875 },
      "cropScale": { "x": 0.771429, "y": 0.771429 },
      "cropOffsetX": 558,
      "cropOffsetY": 0,
      "reason": "chin-jaw-neck-breathing-room",
      "evidencePackage": "tools/people-seed/.work/people-v3-artwork-proof/attempt-20260802T062411Z/landscape-correction/prototypes",
      "proofOutputHash": "28c125e2a8d1dca38d7070486924d8f4ccb6e6a4ae777d3434c198f237048f5a",
      "createdFromAuditVersion": "people-v3-landscape-chin-safe-audit-v1",
      "prototypeTier": "tier-2-moderate"
    },
    {
      "stableKey": "person:655",
      "tmdbPersonId": 655,
      "canonicalName": "John Rhys-Davies",
      "format": "landscape",
      "status": "proof-candidate",
      "sourceProfilePath": "/qpXl1YnqQsUKYEDm3BB2zK5wbhe.jpg",
      "sourceHash": "a00e6f39c4a28ca4dc52aa47c3390cf9028e77f17eb0e078c0c973e384e3a840",
      "basePresetId": "people-landscape-cormorant-v1",
      "basePresetHash": "a94f863b9332332617355fd73265571dc9b3ccf055365674757d76ac2c48faad",
      "cropStrategy": "person-specific-source-bound-landscape-v1",
      "cropRectangle": { "left": 0, "top": 0, "width": 400, "height": 500 },
      "cropScale": { "x": 1.35, "y": 1.35 },
      "cropOffsetX": 558,
      "cropOffsetY": 0,
      "reason": "chin-jaw-neck-breathing-room",
      "evidencePackage": "tools/people-seed/.work/people-v3-artwork-proof/attempt-20260802T062411Z/landscape-correction/prototypes",
      "proofOutputHash": "9b5653cf86854a894eec79c23b8ce530a4c833932d0c0ae635e43169ba9d1453",
      "createdFromAuditVersion": "people-v3-landscape-chin-safe-audit-v1",
      "prototypeTier": "tier-2-moderate"
    },
    {
      "stableKey": "person:1164",
      "tmdbPersonId": 1164,
      "canonicalName": "F. Murray Abraham",
      "format": "landscape",
      "status": "proof-candidate",
      "sourceProfilePath": "/p2RYVGdrcP0m70BkkiKcwyrDeim.jpg",
      "sourceHash": "331f3c5a8da76035b03e276b9af4165033c1282ae20681b7537e9b9492b37a99",
      "basePresetId": "people-landscape-cormorant-v1",
      "basePresetHash": "a94f863b9332332617355fd73265571dc9b3ccf055365674757d76ac2c48faad",
      "cropStrategy": "person-specific-source-bound-landscape-v1",
      "cropRectangle": { "left": 0, "top": 0, "width": 1000, "height": 1250 },
      "cropScale": { "x": 0.54, "y": 0.54 },
      "cropOffsetX": 558,
      "cropOffsetY": 0,
      "reason": "chin-jaw-neck-breathing-room",
      "evidencePackage": "tools/people-seed/.work/people-v3-artwork-proof/attempt-20260802T062411Z/landscape-correction/prototypes",
      "proofOutputHash": "73612c28bd193b7cffd38de05a3449ab56e5b13231766a44be258dc9eee9ed88",
      "createdFromAuditVersion": "people-v3-landscape-chin-safe-audit-v1",
      "prototypeTier": "tier-2-moderate"
    },
    {
      "stableKey": "person:3829",
      "tmdbPersonId": 3829,
      "canonicalName": "Jean-Paul Belmondo",
      "format": "landscape",
      "status": "proof-candidate",
      "sourceProfilePath": "/wTofz0bBIO7kKXATnZNNBF3Jxle.jpg",
      "sourceHash": "0051a266327e6b38a599a3349a0c681374d09aa1592a1e2f70adde5fc3413897",
      "basePresetId": "people-landscape-cormorant-v1",
      "basePresetHash": "a94f863b9332332617355fd73265571dc9b3ccf055365674757d76ac2c48faad",
      "cropStrategy": "person-specific-source-bound-landscape-v1",
      "cropRectangle": { "left": 0, "top": 0, "width": 668, "height": 835 },
      "cropScale": { "x": 0.808383, "y": 0.808383 },
      "cropOffsetX": 558,
      "cropOffsetY": 0,
      "reason": "chin-jaw-neck-breathing-room",
      "evidencePackage": "tools/people-seed/.work/people-v3-artwork-proof/attempt-20260802T062411Z/landscape-correction/prototypes",
      "proofOutputHash": "2ea29795b04a8502643435e33fdd13859f4eac2ba825a7f007e5d425ab8f4dc6",
      "createdFromAuditVersion": "people-v3-landscape-chin-safe-audit-v1",
      "prototypeTier": "tier-2-moderate"
    },
    {
      "stableKey": "person:21041",
      "tmdbPersonId": 21041,
      "canonicalName": "Shohreh Aghdashloo",
      "format": "landscape",
      "status": "proof-candidate",
      "sourceProfilePath": "/7josGC8QO9V6V8AuFdaS2tjUF8W.jpg",
      "sourceHash": "fa6880dd6e6811adff279563a3d6ab805d6bf34a369d506bf4c95809dfb43d83",
      "basePresetId": "people-landscape-cormorant-v1",
      "basePresetHash": "a94f863b9332332617355fd73265571dc9b3ccf055365674757d76ac2c48faad",
      "cropStrategy": "person-specific-source-bound-landscape-v1",
      "cropRectangle": { "left": 0, "top": 0, "width": 720, "height": 900 },
      "cropScale": { "x": 0.75, "y": 0.75 },
      "cropOffsetX": 558,
      "cropOffsetY": 0,
      "reason": "chin-jaw-neck-breathing-room",
      "evidencePackage": "tools/people-seed/.work/people-v3-artwork-proof/attempt-20260802T062411Z/landscape-correction/prototypes",
      "proofOutputHash": "a8ab4a66d5eb08c751383039d3b0643d14c2d789cbf5a04b9eaa6e9571c39fb6",
      "createdFromAuditVersion": "people-v3-landscape-chin-safe-audit-v1",
      "prototypeTier": "tier-2-moderate"
    },
    {
      "stableKey": "person:56734",
      "tmdbPersonId": 56734,
      "canonicalName": "Chloë Grace Moretz",
      "format": "landscape",
      "status": "proof-candidate",
      "sourceProfilePath": "/x2cR7aYB8OoruEY1mpJqGOHYYy9.jpg",
      "sourceHash": "aecef6e61bc21048d2289d62512de115dd1185050d57a43824a54663bee2dba9",
      "basePresetId": "people-landscape-cormorant-v1",
      "basePresetHash": "a94f863b9332332617355fd73265571dc9b3ccf055365674757d76ac2c48faad",
      "cropStrategy": "person-specific-source-bound-landscape-v1",
      "cropRectangle": { "left": 0, "top": 0, "width": 895, "height": 1017 },
      "cropScale": { "x": 0.663687, "y": 0.663717 },
      "cropOffsetX": 504,
      "cropOffsetY": 0,
      "reason": "chin-jaw-neck-breathing-room",
      "evidencePackage": "tools/people-seed/.work/people-v3-artwork-proof/attempt-20260802T062411Z/landscape-correction/prototypes",